ID,Solution,Category,Sector,Horizon,Priority,ROI ($),Productivity ($),ALE Reduction ($),Total Value ($),Cost/yr ($),Net Value ($),ROI %,Effort (1-5),FAIR Risk Links,Description
BOX-01,Boximity Complete Cloud Bundle (All-in-One),Managed Services,SMB + Legal,Quick Win,High,25000,31200,150000,206200,11900,194300,1633.0,1,"CYB-01, CYB-02, CYB-03, CYB-04, CYB-05, OPS-01, OPS-04, COM-01","Enterprise-grade cloud bundle: secure password management, professional email, web hosting, Microsoft collaboration tools, server monitoring, and quarterly IT assessments."
BOX-03,Boximity Proactive IT Management & Monitoring,Managed Services,SMB + Legal,Quick Win,High,18000,27000,120000,165000,7200,157800,2192.0,2,"OPS-01, OPS-02, OPS-04, CYB-01, BCP-03","24/7 server monitoring, automated backups, quarterly security assessments, and managed firewall configuration."
BOX-02,Boximity Enterprise Email Security & Collaboration,Security Tooling,SMB + Legal,Quick Win,High,12000,18000,85000,115000,4800,110200,2296.0,2,"CYB-02, CYB-04, CYB-05, COM-01","Advanced email filtering, secure document sharing, and integrated Microsoft Teams with built-in compliance features."
COL-02,Secure Client Portal (Matter / Document Sharing),Collaboration & Productivity,Legal,Quick Win,High,8000,19800,48000,75800,4800,71000,1479.0,2,"COM-01, CYB-05",Encrypted client-facing portal replacing email for sensitive document exchange and matter updates.
AI-02,AI-Powered Legal Research Assistant (Casetext / Harvey),AI-Assisted Tools,Legal,Mid-Term,High,22000,46200,3000,71200,9600,61600,642.0,2,BCP-02,"Purpose-built legal AI for case research, contract review, and brief drafting. Reduces associate hours on routine tasks."
SEC-01,Endpoint Detection & Response (EDR) — SentinelOne / CrowdStrike,Security Tooling,SMB + Legal,Quick Win,High,0,6120,55000,61120,8400,52720,628.0,2,"CYB-01, CYB-03, OPS-03","AI-driven EDR with rollback capability, threat hunting, and 24/7 MDR overlay."
SEC-04,SIEM / SOC-as-a-Service — Microsoft Sentinel / Huntress,Security Tooling,SMB + Legal,Mid-Term,High,4000,10200,42000,56200,12000,44200,368.0,3,"CYB-01, CYB-05, VND-01, OPS-03","24/7 log aggregation, threat detection, and managed response. Satisfies cyber insurance log requirements."
CLO-03,Immutable Cloud Backup — Veeam / Acronis / Wasabi,Cloud Migration / Infrastructure,SMB + Legal,Quick Win,High,0,3600,45000,48600,4800,43800,912.0,2,"CYB-01, OPS-02, BCP-01",3-2-1-1-0 backup strategy with air-gapped immutable cloud copy. Ransomware-proof recovery.
COL-01,Microsoft 365 Business Premium (Full Deployment),Collaboration & Productivity,SMB + Legal,Quick Win,High,14000,11880,22000,47880,9500,38380,404.0,2,"CYB-03, CYB-04, OPS-04","Unified email, Teams, SharePoint, OneDrive with Intune MDM and Defender for Business included."
AI-04,Automated Compliance Monitoring (Drata / Vanta),AI-Assisted Tools,SMB + Legal,Mid-Term,High,12000,10800,22000,44800,8400,36400,433.0,3,"COM-01, COM-02, COM-03","Continuous control monitoring, evidence collection, and audit readiness for SOC 2, HIPAA, and state privacy laws."
SEC-02,Privileged Access Management (PAM) — CyberArk / Delinea,Security Tooling,SMB + Legal,Mid-Term,High,0,5100,38000,43100,7200,35900,499.0,4,"CYB-03, OPS-03, VND-01",Vault and rotate privileged credentials; enforce just-in-time access for admin accounts.
SEC-05,Multi-Factor Authentication — Entra ID / Duo (All Systems),Security Tooling,SMB + Legal,Quick Win,High,2000,660,35000,37660,1800,35860,1992.0,2,"CYB-02, CYB-03, COM-01","Enforce MFA across all SaaS, VPN, RDP, and on-prem systems via conditional access policies."
AI-03,AI-Driven Threat Detection (Darktrace / Vectra),AI-Assisted Tools,SMB + Legal,Strategic,High,3000,8160,38000,49160,14400,34760,241.0,3,"CYB-01, CYB-05, VND-01, OPS-03",Unsupervised ML models baseline normal network behaviour and autonomously respond to anomalies in real time.
AUT-03,Automated Backup Verification & DR Testing,Automation & RPA,SMB + Legal,Quick Win,High,5000,7200,25000,37200,3600,33600,933.0,2,"OPS-02, BCP-01",Scheduled automated restore tests with pass/fail reporting. Eliminates silent backup failures.
AUT-02,Automated Patch Management — NinjaOne / Automox,Automation & RPA,SMB + Legal,Quick Win,High,7000,10800,18000,35800,4200,31600,752.0,2,"CYB-01, OPS-04, VND-01",Fully automated OS and third-party patching with compliance reporting and rollback capability.
AUT-01,IT Process Automation — Power Automate / Zapier,Automation & RPA,SMB + Legal,Quick Win,High,11000,14400,9000,34400,3000,31400,1047.0,2,"OPS-03, BCP-02","Automate repetitive workflows: employee onboarding/offboarding, ticket routing, report generation."
SEC-03,Security Awareness Training — KnowBe4 / Proofpoint,Security Tooling,SMB + Legal,Quick Win,High,3500,1320,28000,32820,2800,30020,1072.0,1,"CYB-02, CYB-04, COM-01","Continuous phishing simulation, training modules, and compliance tracking for all staff."
AI-01,Microsoft Copilot for M365 (Productivity AI),AI-Assisted Tools,SMB + Legal,Mid-Term,Medium,9500,21840,4000,35340,7200,28140,391.0,2,BCP-02,"AI assistant embedded in Word, Outlook, Teams, and Excel. Drafts, summarises, and automates routine knowledge work."
CLO-01,Cloud-First Infrastructure Migration (Azure / AWS),Cloud Migration / Infrastructure,SMB + Legal,Strategic,Medium,18000,15300,15000,48300,22000,26300,120.0,5,"OPS-01, BCP-01, OPS-04",Migrate on-prem servers to IaaS/PaaS. Eliminates hardware refresh cycle and improves resilience.
CLO-02,SD-WAN / SASE Network Modernisation,Cloud Migration / Infrastructure,SMB + Legal,Mid-Term,Medium,8500,6120,20000,34620,9600,25020,261.0,4,"OPS-01, BCP-03, OPS-04",Replace legacy MPLS/VPN with SD-WAN + SASE (Cloudflare / Zscaler). Improves performance and zero-trust posture.
COL-03,Digital Signature & Contract Automation (DocuSign / Adobe Sign),Collaboration & Productivity,SMB + Legal,Quick Win,Medium,6500,10920,5000,22420,2400,20020,834.0,1,COM-03,"E-signature platform with workflow automation for contracts, onboarding, and compliance docs."
COL-04,VoIP / UCaaS Migration (Teams Phone / RingCentral),Collaboration & Productivity,SMB + Legal,Mid-Term,Medium,9000,5280,6000,20280,5500,14780,269.0,3,BCP-03,"Replace legacy PBX with cloud-hosted VoIP. Includes mobile softphone, call recording, and failover."
